{"command":"-m unittest discover -s tests/unit -v","exit_status":0,"linked_defect":null,"raw_output_hash":"69a3fcec1df5737cd9c1fd18883a7a984c4b1d2e5c4bdac4cf7c350a41a681ff","raw_output_path":"test-results/unit/20261018T052801Z.log","result":"PASS","run_at":"2026-10-18T05:28:01Z","software_versions":{"abos":"0.1.0","os":"macOS-26.6.2-arm64-arm-64bit","python":"3.11.0"},"subject_hash":"04abea64991d8c666774bc44515cb76a47e09c08+dirty","supersedes":null,"test_id":"TEST-20261018052801","tester_role":"SUITE"}
