{"command":"-m unittest discover -s tests/unit -v","exit_status":0,"linked_defect":null,"raw_output_hash":"721755007b56e12fe312d6680543165378fc3e68e1226fde080c14b31634a736","raw_output_path":"test-results/unit/20261018T031009Z.log","result":"PASS","run_at":"2026-10-18T03:10:09Z","software_versions":{"abos":"0.1.0","os":"macOS-26.6.2-arm64-arm-64bit","python":"3.11.0"},"subject_hash":"f279392ab06bbb2227546fa6a61bbbcda8a66844+dirty","supersedes":null,"test_id":"TEST-20261018031009","tester_role":"SUITE"}
