{"command":"-m unittest discover -s tests/unit -v","exit_status":0,"linked_defect":null,"raw_output_hash":"8ea5c85b5bad20cf613a91d1d7a721ab9b4a442ae79ea6504c690c54391fe836","raw_output_path":"test-results/unit/20261018T104251Z.log","result":"PASS","run_at":"2026-10-18T10:42:51Z","software_versions":{"abos":"0.1.0","os":"macOS-26.6.2-arm64-arm-64bit","python":"3.11.0"},"subject_hash":"a5b0e690cbdf5c1f9ff04b3078a69d3dc2184e34+dirty","supersedes":null,"test_id":"TEST-20261018104251","tester_role":"SUITE"}
