{"command":"-m unittest discover -s tests/unit -v","exit_status":0,"linked_defect":null,"raw_output_hash":"bf0f2f8030b84a39ab1fccb580753a1bf1bcc5b525c186fee59f2c3a49d0bf9b","raw_output_path":"test-results/unit/20261018T100258Z.log","result":"PASS","run_at":"2026-10-18T10:02:58Z","software_versions":{"abos":"0.1.0","os":"macOS-26.6.2-arm64-arm-64bit","python":"3.11.0"},"subject_hash":"70c3c791664544a5f63d37ddb69db5804984971d+dirty","supersedes":null,"test_id":"TEST-20261018100258","tester_role":"SUITE"}
