{"command":"-m unittest discover -s tests/unit -v","exit_status":0,"linked_defect":null,"raw_output_hash":"a167be2ed3f3f6ef08df224cbf2d21e745d6861ba071daf7b22dc3a9500fad77","raw_output_path":"test-results/unit/20261018T044216Z.log","result":"PASS","run_at":"2026-10-18T04:42:16Z","software_versions":{"abos":"0.1.0","os":"macOS-26.6.2-arm64-arm-64bit","python":"3.11.0"},"subject_hash":"a434d7b3f379ad19235efd505cea0dc960f017d4+dirty","supersedes":null,"test_id":"TEST-20261018044216","tester_role":"SUITE"}
