{"command":"-m unittest discover -s tests/unit -v","exit_status":1,"linked_defect":null,"raw_output_hash":"af5ba27b4fd31272cc6d0d1170e487e0503f1429176f11b46f097c413e7aaa3a","raw_output_path":"test-results/unit/20261018T051207Z.log","result":"FAIL","run_at":"2026-10-18T05:12:07Z","software_versions":{"abos":"0.1.0","os":"macOS-26.6.2-arm64-arm-64bit","python":"3.11.0"},"subject_hash":"fb4774a538184e26ae39fb25e80e097fc5377797+dirty","supersedes":null,"test_id":"TEST-20261018051207","tester_role":"SUITE"}
