{"command":"-m unittest discover -s tests/unit -v","exit_status":0,"linked_defect":null,"raw_output_hash":"5f4594179abee40246d8c68a63e4306832f21dcf2b4850dc0c0a1c3cbcb6ce62","raw_output_path":"test-results/unit/20261018T045733Z.log","result":"PASS","run_at":"2026-10-18T04:57:33Z","software_versions":{"abos":"0.1.0","os":"macOS-26.6.2-arm64-arm-64bit","python":"3.11.0"},"subject_hash":"fb4774a538184e26ae39fb25e80e097fc5377797+dirty","supersedes":null,"test_id":"TEST-20261018045733","tester_role":"SUITE"}
