{"command":"-m unittest discover -s tests/unit -v","exit_status":0,"linked_defect":null,"raw_output_hash":"6f7a62324bb2cdc7388ac4ef69798c66017bbfbef8ae8b55dfaeb1caa5d2f199","raw_output_path":"test-results/unit/20261018T033035Z.log","result":"PASS","run_at":"2026-10-18T03:30:35Z","software_versions":{"abos":"0.1.0","os":"macOS-26.6.2-arm64-arm-64bit","python":"3.11.0"},"subject_hash":"3026693d3dcca3fcec3b3f8f58c468e2543d434a+dirty","supersedes":null,"test_id":"TEST-20261018033035","tester_role":"SUITE"}
