{"command":"-m unittest discover -s tests/unit -v","exit_status":0,"linked_defect":null,"raw_output_hash":"6583545fb86ed138ffe3b7455016bcfe15256ee47c1fcdc96e893870bea40589","raw_output_path":"test-results/unit/20261018T105719Z.log","result":"PASS","run_at":"2026-10-18T10:57:19Z","software_versions":{"abos":"0.1.0","os":"macOS-26.6.2-arm64-arm-64bit","python":"3.11.0"},"subject_hash":"14b0da7fd3c7471d70c79ab37756a2565fea30bd+dirty","supersedes":null,"test_id":"TEST-20261018105719","tester_role":"SUITE"}
