{"command":"-m unittest discover -s tests/unit -v","exit_status":0,"linked_defect":null,"raw_output_hash":"8dd8ebb4448c4e3aafcbe3065bc8e2878bbb0e52e9ec9b23f41afbb7ee507983","raw_output_path":"test-results/unit/20261018T045415Z.log","result":"PASS","run_at":"2026-10-18T04:54:15Z","software_versions":{"abos":"0.1.0","os":"macOS-26.6.2-arm64-arm-64bit","python":"3.11.0"},"subject_hash":"e79a9a312665b3f005c1df4a428e59cd26eb0e6d+dirty","supersedes":null,"test_id":"TEST-20261018045415","tester_role":"SUITE"}
