{"command":"-m unittest discover -s tests/unit -v","exit_status":0,"linked_defect":null,"raw_output_hash":"640130736b61c5069a73186c16b0e3bd33e0ae59f25c9eaf3cb2d13cefc59302","raw_output_path":"test-results/unit/20261020T023514Z.log","result":"PASS","run_at":"2026-10-20T02:35:14Z","software_versions":{"abos":"0.1.0","os":"macOS-26.6.2-arm64-arm-64bit","python":"3.11.0"},"subject_hash":"c9fcf0d2c43761974923beda3131ebf242e42c1e+dirty","supersedes":null,"test_id":"TEST-20261020023514","tester_role":"SUITE"}
