{"command":"-m unittest discover -s tests/unit -v","exit_status":0,"linked_defect":null,"raw_output_hash":"fcc1f544315d2a0dd920724d0b5d44d2c8c1a33647f86a4fe6e6d11b0b93c8fa","raw_output_path":"test-results/unit/20261018T103530Z.log","result":"PASS","run_at":"2026-10-18T10:35:30Z","software_versions":{"abos":"0.1.0","os":"macOS-26.6.2-arm64-arm-64bit","python":"3.11.0"},"subject_hash":"a9ab0af1d7b1cb9cc4f0f5bfbf8103e47432e84d+dirty","supersedes":null,"test_id":"TEST-20261018103530","tester_role":"SUITE"}
