{"command":"-m unittest discover -s tests/unit -v","exit_status":0,"linked_defect":null,"raw_output_hash":"4f123d577e2cf026bd649037fa6803701abcb95befda7f3dcf54f84e71b83f7a","raw_output_path":"test-results/unit/20261018T033412Z.log","result":"PASS","run_at":"2026-10-18T03:34:12Z","software_versions":{"abos":"0.1.0","os":"macOS-26.6.2-arm64-arm-64bit","python":"3.11.0"},"subject_hash":"3ed335d03122e2d09b1edec5678647aaa99d8446+dirty","supersedes":null,"test_id":"TEST-20261018033412","tester_role":"SUITE"}
