{"command":"-m unittest discover -s tests/unit -v","exit_status":0,"linked_defect":null,"raw_output_hash":"a32fadeb22be752362cbb33c9a5e3884409907e5b73da86f9dfbbd439dac2301","raw_output_path":"test-results/unit/20261018T044801Z.log","result":"PASS","run_at":"2026-10-18T04:48:01Z","software_versions":{"abos":"0.1.0","os":"macOS-26.6.2-arm64-arm-64bit","python":"3.11.0"},"subject_hash":"e6e4873a7aef18eaaf69eae90fafadf4d8e3b458+dirty","supersedes":null,"test_id":"TEST-20261018044801","tester_role":"SUITE"}
