{"command":"-m unittest discover -s tests/unit -v","exit_status":0,"linked_defect":null,"raw_output_hash":"529fcf11a717f2a413d8764dc236d66f872d270ab66f128166c8c349224a2591","raw_output_path":"test-results/unit/20261020T022532Z.log","result":"PASS","run_at":"2026-10-20T02:25:32Z","software_versions":{"abos":"0.1.0","os":"macOS-26.6.2-arm64-arm-64bit","python":"3.11.0"},"subject_hash":"ab63f0671b7e18477401a3e113ac1b8b703b6830+dirty","supersedes":null,"test_id":"TEST-20261020022532","tester_role":"SUITE"}
