{"command":"-m unittest discover -s tests/unit -v","exit_status":0,"linked_defect":null,"raw_output_hash":"4d63ec732f6ee433e3d7f248f4a6acd585a4829f724dee291cff1605b1dabb6c","raw_output_path":"test-results/unit/20261018T035431Z.log","result":"PASS","run_at":"2026-10-18T03:54:31Z","software_versions":{"abos":"0.1.0","os":"macOS-26.6.2-arm64-arm-64bit","python":"3.11.0"},"subject_hash":"3da00306aae7e39ae25a4f232f04f58cd15eba7b+dirty","supersedes":null,"test_id":"TEST-20261018035431","tester_role":"SUITE"}
