{"command":"-m unittest discover -s tests/unit -v","exit_status":0,"linked_defect":null,"raw_output_hash":"36385aab7e553b002f308537e4b338490976b049c0d8f771e44216b711b01f37","raw_output_path":"test-results/unit/20261019T143912Z.log","result":"PASS","run_at":"2026-10-19T14:39:12Z","software_versions":{"abos":"0.1.0","os":"macOS-26.6.2-arm64-arm-64bit","python":"3.11.0"},"subject_hash":"52e2302dfd3a93078475a50c0d3e7df3a4804058+dirty","supersedes":null,"test_id":"TEST-20261019143912","tester_role":"SUITE"}
