{"command":"-m unittest discover -s tests/unit -v","exit_status":0,"linked_defect":null,"raw_output_hash":"044744a2527f9b38d2fd327cd57e878f72c21ae40dc2541b13973e0084f2b59e","raw_output_path":"test-results/unit/20261018T102851Z.log","result":"PASS","run_at":"2026-10-18T10:28:51Z","software_versions":{"abos":"0.1.0","os":"macOS-26.6.2-arm64-arm-64bit","python":"3.11.0"},"subject_hash":"dd1e77cfe3b09e3319b97589c8a3d96e951176ca+dirty","supersedes":null,"test_id":"TEST-20261018102851","tester_role":"SUITE"}
