{"command":"-m unittest discover -s tests/unit -v","exit_status":0,"linked_defect":null,"raw_output_hash":"7a508890b6daf3d83e5c8f7f472f40211cf4155cb6dc18adb5100a8753aabda8","raw_output_path":"test-results/unit/20261018T043518Z.log","result":"PASS","run_at":"2026-10-18T04:35:18Z","software_versions":{"abos":"0.1.0","os":"macOS-26.6.2-arm64-arm-64bit","python":"3.11.0"},"subject_hash":"5003982ed5d609a8cf37e3612d6be4e0167685c1+dirty","supersedes":null,"test_id":"TEST-20261018043518","tester_role":"SUITE"}
