{"command":"-m unittest discover -s tests/unit -v","exit_status":0,"linked_defect":null,"raw_output_hash":"9fc7d32dc78ffab1a8ac13a544583a81409fe2e41d7f2ff535591bff2c523bfe","raw_output_path":"test-results/unit/20261018T031836Z.log","result":"PASS","run_at":"2026-10-18T03:18:36Z","software_versions":{"abos":"0.1.0","os":"macOS-26.6.2-arm64-arm-64bit","python":"3.11.0"},"subject_hash":"a43eb90bac978fddf628a4d07ae002ea7f25ad39+dirty","supersedes":null,"test_id":"TEST-20261018031836","tester_role":"SUITE"}
