{"command":"-m unittest discover -s tests/unit -v","exit_status":0,"linked_defect":null,"raw_output_hash":"e8e06a41ff42fb03bc041a66f592f7717276ff2b068724f280d1a4cd08221924","raw_output_path":"test-results/unit/20261018T051946Z.log","result":"PASS","run_at":"2026-10-18T05:19:46Z","software_versions":{"abos":"0.1.0","os":"macOS-26.6.2-arm64-arm-64bit","python":"3.11.0"},"subject_hash":"8336037e87cf5a9a0127bc8161804af3723dbff0+dirty","supersedes":null,"test_id":"TEST-20261018051946","tester_role":"SUITE"}
