{"command":"-m unittest discover -s tests/unit -v","exit_status":0,"linked_defect":null,"raw_output_hash":"5e8131c9c6d9fc7fd2a1bffbf06f9838da1084a6d3aaa1cf0f1d43dad65a6277","raw_output_path":"test-results/unit/20261018T044429Z.log","result":"PASS","run_at":"2026-10-18T04:44:29Z","software_versions":{"abos":"0.1.0","os":"macOS-26.6.2-arm64-arm-64bit","python":"3.11.0"},"subject_hash":"64d3e10d621add6085022e40ec75deab349c3022+dirty","supersedes":null,"test_id":"TEST-20261018044429","tester_role":"SUITE"}
