{"command":"-m unittest discover -s tests/unit -v","exit_status":0,"linked_defect":null,"raw_output_hash":"3f194db24178c4f0e58e73b6269afe82017d847238efdc4404c713c1518ebede","raw_output_path":"test-results/unit/20261018T111034Z.log","result":"PASS","run_at":"2026-10-18T11:10:34Z","software_versions":{"abos":"0.1.0","os":"macOS-26.6.2-arm64-arm-64bit","python":"3.11.0"},"subject_hash":"66abfe3044025b9a3e304568c93e23fb6d839c5b+dirty","supersedes":null,"test_id":"TEST-20261018111034","tester_role":"SUITE"}
