{"command":"-m unittest discover -s tests/unit -v","exit_status":0,"linked_defect":null,"raw_output_hash":"fc4036bf5ac09b972a5d63de0768efe9a29ec0fe1421011d26859d06cc54c047","raw_output_path":"test-results/unit/20261018T031824Z.log","result":"PASS","run_at":"2026-10-18T03:18:24Z","software_versions":{"abos":"0.1.0","os":"macOS-26.6.2-arm64-arm-64bit","python":"3.11.0"},"subject_hash":"e3b2a60a5b5b2e547a01b6d59fced31aeba0d773+dirty","supersedes":null,"test_id":"TEST-20261018031824","tester_role":"SUITE"}
